18:00:22.873817 IP 10.20.0.13.59804 > 209.54.182.89.443: Flags [P.], seq 452135:453316, ack 45340, win 1542, length 1181
18:00:22.873845 IP 209.54.182.89.443 > 10.20.0.13.59804: Flags [.], ack 442689, win 25758, length 0
18:00:22.873850 IP 209.54.182.89.443 > 10.20.0.13.59804: Flags [.], ack 443870, win 25758, length 0
18:00:22.873874 IP 10.20.0.13.59804 > 209.54.182.89.443: Flags [P.], seq 453316:454497, ack 45340, win 1542, length 1181
18:00:22.873909 IP 10.20.0.13.59804 > 209.54.182.89.443: Flags [P.], seq 454497:455678, ack 45340, win 1542, length 1181
18:00:22.873916 IP 209.54.182.89.443 > 10.20.0.13.59804: Flags [.], ack 445051, win 25740, length 0
18:00:22.873950 IP 10.20.0.13.59804 > 209.54.182.89.443: Flags [P.], seq 455678:456858, ack 45340, win 1542, length 1180
18:00:22.873970 IP 209.54.182.89.443 > 10.20.0.13.59804: Flags [.], ack 446232, win 25721, length 0
18:00:22.874020 IP 10.20.0.13.59804 > 209.54.182.89.443: Flags [P.], seq 456858:458039, ack 45340, win 1542, length 1181
18:00:22.874059 IP 209.54.182.89.443 > 10.20.0.13.59804: Flags [.], ack 447412, win 25703, length 0
18:00:22.874063 IP 209.54.182.89.443 > 10.20.0.13.59804: Flags [.], ack 448593, win 25703, length 0
18:00:22.874067 IP 10.20.0.13.59804 > 209.54.182.89.443: Flags [P.], seq 458039:459220, ack 45340, win 1542, length 1181
18:00:22.874109 IP 10.20.0.13.59804 > 209.54.182.89.443: Flags [P.], seq 459220:460401, ack 45340, win 1542, length 1181
18:00:22.874146 IP 10.20.0.13.59804 > 209.54.182.89.443: Flags [P.], seq 460401:461581, ack 45340, win 1542, length 1180
18:00:22.874184 IP 209.54.182.89.443 > 10.20.0.13.59804: Flags [.], ack 449774, win 25648, length 0
18:00:22.874189 IP 209.54.182.89.443 > 10.20.0.13.59804: Flags [.], ack 450955, win 25648, length 0
18:00:22.874214 IP 10.20.0.13.59804 > 209.54.182.89.443: Flags [P.], seq 461581:462762, ack 45340, win 1542, length 1181
18:00:22.874258 IP 10.20.0.13.59804 > 209.54.182.89.443: Flags [P.], seq 462762:463943, ack 45340, win 1542, length 1181
18:00:22.874265 IP 209.54.182.89.443 > 10.20.0.13.59804: Flags [.], ack 452135, win 25648, length 0
18:00:22.874304 IP 10.20.0.13.59804 > 209.54.182.89.443: Flags [P.], seq 463943:465124, ack 45340, win 1542, length 1181
18:00:22.874330 IP 209.54.182.89.443 > 10.20.0.13.59804: Flags [.], ack 453316, win 25611, length 0
18:00:22.874346 IP 209.54.182.89.443 > 10.20.0.13.59804: Flags [.], ack 454497, win 25592, length 0
18:00:22.874353 IP 10.20.0.13.59804 > 209.54.182.89.443: Flags [P.], seq 465124:466304, ack 45340, win 1542, length 1180
18:00:22.874443 IP 209.54.182.89.443 > 10.20.0.13.59804: Flags [.], ack 455678, win 25555, length 0
18:00:22.874487 IP 10.20.0.13.59804 > 209.54.182.89.443: Flags [P.], seq 466304:467485, ack 45340, win 1542, length 1181
18:00:22.874493 IP 209.54.182.89.443 > 10.20.0.13.59804: Flags [.], ack 456858, win 25537, length 0
18:00:22.874533 IP 10.20.0.13.59804 > 209.54.182.89.443: Flags [P.], seq 467485:468666, ack 45340, win 1542, length 1181
18:00:22.874551 IP 209.54.182.89.443 > 10.20.0.13.59804: Flags [.], ack 458039, win 25537, length 0
18:00:22.874555 IP 209.54.182.89.443 > 10.20.0.13.59804: Flags [.], ack 459220, win 25537, length 0
18:00:22.874581 IP 10.20.0.13.59804 > 209.54.182.89.443: Flags [P.], seq 468666:469847, ack 45340, win 1542, length 1181
18:00:22.874619 IP 10.20.0.13.59804 > 209.54.182.89.443: Flags [P.], seq 469847:471027, ack 45340, win 1542, length 1180
18:00:22.874635 IP 209.54.182.89.443 > 10.20.0.13.59804: Flags [.], ack 460401, win 25500, length 0
18:00:22.874688 IP 10.20.0.13.59804 > 209.54.182.89.443: Flags [P.], seq 471027:472208, ack 45340, win 1542, length 1181
18:00:22.874690 IP 209.54.182.89.443 > 10.20.0.13.59804: Flags [.], ack 461581, win 25482, length 0
18:00:22.874735 IP 209.54.182.89.443 > 10.20.0.13.59804: Flags [.], ack 462762, win 25482, length 0
18:00:22.874757 IP 10.20.0.13.59804 > 209.54.182.89.443: Flags [P.], seq 472208:473389, ack 45340, win 1542, length 1181
18:00:22.874795 IP 10.20.0.13.59804 > 209.54.182.89.443: Flags [P.], seq 473389:474570, ack 45340, win 1542, length 1181
18:00:22.874828 IP 209.54.182.89.443 > 10.20.0.13.59804: Flags [.], ack 463943, win 25445, length 0
18:00:22.874832 IP 209.54.182.89.443 > 10.20.0.13.59804: Flags [.], ack 465124, win 25445, length 0
18:00:22.874837 IP 10.20.0.13.59804 > 209.54.182.89.443: Flags [P.], seq 474570:475750, ack 45340, win 1542, length 1180
18:00:22.874873 IP 209.54.182.89.443 > 10.20.0.13.59804: Flags [.], ack 466304, win 25445, length 0
18:00:22.874916 IP 10.20.0.13.59804 > 209.54.182.89.443: Flags [P.], seq 475750:476931, ack 45340, win 1542, length 1181
18:00:22.874487 IP 10.20.0.13.59804 > 209.54.182.89.443: Flags [P.], seq 466304:467485, ack 45340, win 1542, length 1181
18:00:22.874493 IP 209.54.182.89.443 > 10.20.0.13.59804: Flags [.], ack 456858, win 25537, length 0
18:00:22.874533 IP 10.20.0.13.59804 > 209.54.182.89.443: Flags [P.], seq 467485:468666, ack 45340, win 1542, length 1181
18:00:22.874551 IP 209.54.182.89.443 > 10.20.0.13.59804: Flags [.], ack 458039, win 25537, length 0
18:00:22.874555 IP 209.54.182.89.443 > 10.20.0.13.59804: Flags [.], ack 459220, win 25537, length 0
18:00:22.874581 IP 10.20.0.13.59804 > 209.54.182.89.443: Flags [P.], seq 468666:469847, ack 45340, win 1542, length 1181
18:00:22.874619 IP 10.20.0.13.59804 > 209.54.182.89.443: Flags [P.], seq 469847:471027, ack 45340, win 1542, length 1180
18:00:22.874635 IP 209.54.182.89.443 > 10.20.0.13.59804: Flags [.], ack 460401, win 25500, length 0
18:00:22.874688 IP 10.20.0.13.59804 > 209.54.182.89.443: Flags [P.], seq 471027:472208, ack 45340, win 1542, length 1181
18:00:22.874690 IP 209.54.182.89.443 > 10.20.0.13.59804: Flags [.], ack 461581, win 25482, length 0
18:00:22.874735 IP 209.54.182.89.443 > 10.20.0.13.59804: Flags [.], ack 462762, win 25482, length 0
18:00:22.874757 IP 10.20.0.13.59804 > 209.54.182.89.443: Flags [P.], seq 472208:473389, ack 45340, win 1542, length 1181
18:00:22.874795 IP 10.20.0.13.59804 > 209.54.182.89.443: Flags [P.], seq 473389:474570, ack 45340, win 1542, length 1181
18:00:22.874828 IP 209.54.182.89.443 > 10.20.0.13.59804: Flags [.], ack 463943, win 25445, length 0
18:00:22.874832 IP 209.54.182.89.443 > 10.20.0.13.59804: Flags [.], ack 465124, win 25445, length 0
18:00:22.874837 IP 10.20.0.13.59804 > 209.54.182.89.443: Flags [P.], seq 474570:475750, ack 45340, win 1542, length 1180
18:00:22.874873 IP 209.54.182.89.443 > 10.20.0.13.59804: Flags [.], ack 466304, win 25445, length 0
18:00:22.874916 IP 10.20.0.13.59804 > 209.54.182.89.443: Flags [P.], seq 475750:476931, ack 45340, win 1542, length 1181